{
  "review_type": "spec",
  "verdict": "accept",
  "scores": {
    "correctness": 5,
    "completeness": 5,
    "style": 5
  },
  "summary": "Accept. The holly-ops-branding OpenSpec change is spec-only, aligns with the requested low-risk user-facing rename, and explicitly preserves Scion runtime terminology and compatibility identifiers including Kubernetes resources, MCP tools, environment variables, task/script interfaces, branch/session conventions, and .scion-ops state. Requirements and tasks are actionable and include focused verification for branding copy plus compatibility preservation.",
  "spec": {
    "change": "holly-ops-branding",
    "conformance": 5,
    "spec_completeness": 5,
    "task_coverage": 5,
    "operational_verification": 5,
    "checked_artifacts": [
      "openspec/changes/holly-ops-branding/proposal.md",
      "openspec/changes/holly-ops-branding/design.md",
      "openspec/changes/holly-ops-branding/tasks.md",
      "openspec/changes/holly-ops-branding/specs/web-app-hub/spec.md",
      "openspec/changes/holly-ops-branding/specs/scion-consensus-rounds/spec.md",
      "scripts/validate-openspec-change.py --project-root . --change holly-ops-branding",
      "git diff --name-status origin/round-20260510t184811z-44fc-spec-steward...round-20260510t184811z-44fc-spec-integration"
    ],
    "unresolved_questions": [],
    "gaps": []
  }
}
